{
  "$schema": "docs/evidence/coding-agent-work-index/v1.schema.json",
  "schema_version": "agentflow.dev/coding-agent-work-index/v1",
  "index_version": 1,
  "entries": [
    {
      "id": "implementation-structured-handoff",
      "task_class": "implementation",
      "title": "Implement provider-independent semantic context and handoffs",
      "scope": "Build a closed semantic context representation, isolate provider projection, and preserve compatible runtime behavior.",
      "outcome": {
        "status": "implementation_evidence_present",
        "summary": "The implementation, correction cycle, and final independent approval are represented by checked-in code, tests, and this sanitized orchestration trace."
      },
      "evidence": [
        {
          "id": "implementation-handoff-tests",
          "kind": "test",
          "repo_relative_path": "internal/engine/handoff_test.go",
          "description": "Covers staged handoff integrity, semantic encoding validation, and recovery rejection paths."
        },
        {
          "id": "implementation-semantic-context",
          "kind": "implementation",
          "repo_relative_path": "internal/engine/semantic_context.go",
          "description": "Defines the runtime-owned semantic handoff representation."
        },
        {
          "id": "implementation-trace",
          "kind": "sanitized_trace",
          "repo_relative_path": "docs/evidence/coding-agent-work-index/v1.json",
          "description": "This entry's allowlisted action sequence, derived from the digest-identified orchestration ledger."
        }
      ],
      "trace": {
        "status": "captured",
        "source_evidence_ids": ["implementation-trace"],
        "source": {
          "record_type": "structured_context_event_ledger",
          "ledger_sha256": "sha256:f056743ad158fa309bf8c946f60fff4a0780668f2fa3024b3184b2a2a629485c",
          "sequence_first": 2,
          "sequence_last": 20,
          "derivation": "Ordered role phases, summarized changes, validation categories, and final status were manually projected from allowlisted event fields; raw conversation and command material were excluded."
        },
        "actions": [
          {"order": 1, "phase": "implementation", "action_summary": "Implemented semantic context types, provider projection isolation, handoff conversion, and compatibility regressions.", "tool_categories": ["cross-platform-build", "repository-editing", "static-analysis", "test-execution"]},
          {"order": 2, "phase": "independent-review", "action_summary": "Found semantic validation, context-selection, compatibility, and repair-preflight gaps.", "tool_categories": ["code-review", "static-analysis", "test-execution"]},
          {"order": 3, "phase": "correction", "action_summary": "Corrected the four reported gaps and extended provider-mode preflight coverage.", "tool_categories": ["repository-editing", "static-analysis", "test-execution"]},
          {"order": 4, "phase": "final-review", "action_summary": "Verified semantic boundaries and every reviewed provider invocation mode, then approved the work.", "tool_categories": ["code-review", "static-analysis", "test-execution"]}
        ]
      },
      "metrics": [
        {"name": "token_count", "status": "unavailable", "unit": "tokens", "provenance": {"evidence_ids": ["implementation-trace"], "reason": "The source ledger has no provider token telemetry."}},
        {"name": "tool_calls", "status": "unavailable", "unit": "calls", "provenance": {"evidence_ids": ["implementation-trace"], "reason": "The source ledger records validation categories but not a complete tool-call count."}},
        {"name": "review_time", "status": "derived", "unit": "minutes", "value": 59.9, "provenance": {"evidence_ids": ["implementation-trace"], "calculation": {"operation": "elapsed_minutes", "started_at": "2026-09-04T13:19:45Z", "ended_at": "2026-09-04T14:19:39Z", "decimal_places": 1}}}
      ]
    },
    {
      "id": "isolated-workflow-validation",
      "task_class": "isolated_workflow_validation",
      "title": "Validate the canonical workflow in an isolated repository",
      "scope": "Exercise ordinary and structured phases, handoff binding, scratch containment, completion, and idempotent rerun behavior.",
      "outcome": {
        "status": "validation_evidence_present",
        "summary": "A corrected disposable harness produced independently verified evidence while leaving the source repository unchanged."
      },
      "evidence": [
        {
          "id": "isolated-validation-closure",
          "kind": "evidence_document",
          "repo_relative_path": "docs/evidence/canonical-self-hosting-migration.md",
          "description": "Documents the canonical workflow's executable proof boundary."
        },
        {
          "id": "isolated-validation-test",
          "kind": "test",
          "repo_relative_path": "internal/engine/reference_workflow_test.go",
          "description": "Exercises the canonical workflow in an isolated Git repository."
        },
        {
          "id": "isolated-validation-trace",
          "kind": "sanitized_trace",
          "repo_relative_path": "docs/evidence/coding-agent-work-index/v1.json",
          "description": "This entry's allowlisted action sequence, derived from the digest-identified orchestration ledger."
        }
      ],
      "trace": {
        "status": "captured",
        "source_evidence_ids": ["isolated-validation-trace"],
        "source": {
          "record_type": "structured_context_event_ledger",
          "ledger_sha256": "sha256:c52ccd37b841055681c9a8adc429c23dd2c701dcbf558587e7821552c1fb3a1d",
          "sequence_first": 2,
          "sequence_last": 12,
          "derivation": "Ordered phases and validation summaries were manually projected from allowlisted event fields; disposable paths, runtime identities, raw adapter material, and command output were excluded."
        },
        "actions": [
          {"order": 1, "phase": "isolated-validation", "action_summary": "Ran the canonical workflow and retained bounded evidence for completion, handoffs, and rerun behavior.", "tool_categories": ["evidence-capture", "isolated-workflow", "test-execution"]},
          {"order": 2, "phase": "independent-review", "action_summary": "Identified that exact adapter-boundary evidence had been discarded by the first harness.", "tool_categories": ["code-review", "evidence-verification"]},
          {"order": 3, "phase": "correction", "action_summary": "Reran the workflow with append-only sanitized boundary records and containment assertions.", "tool_categories": ["evidence-capture", "isolated-workflow", "test-execution"]},
          {"order": 4, "phase": "final-review", "action_summary": "Verified exact context shapes, handoff binding, containment, safe traces, completion, and idempotent rerun.", "tool_categories": ["code-review", "evidence-verification", "test-execution"]}
        ]
      },
      "metrics": [
        {"name": "token_count", "status": "unavailable", "unit": "tokens", "provenance": {"evidence_ids": ["isolated-validation-trace"], "reason": "The controlled validation ledger does not contain provider token telemetry."}},
        {"name": "tool_calls", "status": "unavailable", "unit": "calls", "provenance": {"evidence_ids": ["isolated-validation-trace"], "reason": "The ledger reports selected validation results but not a complete comparable tool-call count."}},
        {"name": "review_time", "status": "derived", "unit": "minutes", "value": 22.3333, "provenance": {"evidence_ids": ["isolated-validation-trace"], "calculation": {"operation": "elapsed_minutes", "started_at": "2026-09-04T14:53:44Z", "ended_at": "2026-09-04T15:16:04Z", "decimal_places": 4}}}
      ]
    },
    {
      "id": "provider-tool-extensibility",
      "task_class": "provider_tool_extensibility",
      "title": "Correct provider capability negotiation and preflight coverage",
      "scope": "Preserve provider-independent compilation while ensuring ordinary, structured, repair, and mixed-mode invocations are rejected before incompatible execution.",
      "outcome": {
        "status": "implementation_evidence_present",
        "summary": "Successive review findings expanded preflight coverage until final review found no remaining provider invocation gap."
      },
      "evidence": [
        {
          "id": "provider-tool-tests",
          "kind": "test",
          "repo_relative_path": "internal/engine/extensions_test.go",
          "description": "Covers provider contracts, typed tools, malformed configuration, and capability rejection."
        },
        {
          "id": "provider-tool-trace",
          "kind": "sanitized_trace",
          "repo_relative_path": "docs/evidence/coding-agent-work-index/v1.json",
          "description": "This entry's allowlisted preflight correction sequence from the digest-identified orchestration ledger."
        }
      ],
      "trace": {
        "status": "captured",
        "source_evidence_ids": ["provider-tool-trace"],
        "source": {
          "record_type": "structured_context_event_ledger",
          "ledger_sha256": "sha256:f056743ad158fa309bf8c946f60fff4a0780668f2fa3024b3184b2a2a629485c",
          "sequence_first": 4,
          "sequence_last": 20,
          "derivation": "Provider-mode findings and bounded correction checkpoints were manually projected from allowlisted event fields and grouped without retaining provider payloads or command material."
        },
        "actions": [
          {"order": 1, "phase": "review", "action_summary": "Detected that ordinary phases could preflight a provider lacking the context version used at runtime.", "tool_categories": ["code-review", "test-execution"]},